<?xml version="1.0" encoding="UTF-8"?><ApplicationAcknowledgement xmlns="http://ns.hr-xml.org/2007-04-15" xmlns:xsi="http://www.w3.org/2001/XMLSchema-instance" xsi:schemaLocation="http://ns.hr-xml.org/2007-04-15 ApplicationAcknowledgement.xsd">	<PayloadResponseSummary>		<TransportMessageId>			<MessageIdType>MQSeriesTransactionID</MessageIdType>			<MessageId>				<IdValue>444415555</IdValue>			</MessageId>		</TransportMessageId>		<UniquePayloadTrackingId>			<IdValue>0083333333330080000D59772004-05-17-18.40.33.000000137489755</IdValue>		</UniquePayloadTrackingId>		<TransactionReceiptTimestamp>2004-05-17T18:40:59Z</TransactionReceiptTimestamp>		<ProcessingTimestamp>2004-05-17T18:41:30Z</ProcessingTimestamp>		<AcknowledgementCreationTimestamp>2004-05-17T18:41:45Z</AcknowledgementCreationTimestamp>		<ReceivedPayloadSummary>			<ReceivedPayloadSchemaURI> http://ns.hr-xml_2-3/Enrollment.xsd </ReceivedPayloadSchemaURI>			<EntityInfo>				<EntityInstanceAxisXPath>/Enrollment/Organization/Subscriber</EntityInstanceAxisXPath>				<Count>1</Count>				<EntityShortName>Subscribers</EntityShortName>			</EntityInfo>			<EntityInfo>				<EntityInstanceAxisXPath>/Enrollment/Organization/Subscriber/Dependent</EntityInstanceAxisXPath>				<Count>2</Count>				<EntityShortName>Dependents</EntityShortName>			</EntityInfo>			<EntityInfo>				<EntityInstanceAxisXPath>/Enrollment/Organization/Subscriber/Dependent[position()=1]</EntityInstanceAxisXPath>				<Count>1</Count>				<EntityShortName>Dependents with Errors</EntityShortName>			</EntityInfo>		</ReceivedPayloadSummary>	</PayloadResponseSummary>	<PayloadDisposition>		<EntityDisposition>			<EntityIdentifier>				<IdValue name="SocialSecurityNumber"> 536403123 </IdValue>			</EntityIdentifier>			<EntitySchemaXPath>/Enrollment/Organization/Subscriber</EntitySchemaXPath>			<EntityInstanceXPath>/Enrollment/Organization/Subscriber[position()=1]</EntityInstanceXPath>			<EntityException>				<Exception>					<ExceptionIdentifier>996</ExceptionIdentifier>					<ExceptionSeverity>Warning</ExceptionSeverity>					<ExceptionMessage>Missing Spouse SSN</ExceptionMessage>					<ExceptionScopeSchemaXPath>/Enrollment/Organization/Subscriber/Dependent[position()=1]</ExceptionScopeSchemaXPath>					<SubordinateEntityXPath>/Enrollment/Organization/Subscriber/Dependent[position()=1]/Person/IdentificationCode/IdValue</SubordinateEntityXPath>					<Followup responsibleForFollowup="Payload Source Organization">						<OrganizationId>							<IdValue name="TaxpayerID">444415555</IdValue>						</OrganizationId>						<OrganizationName>BeneFriends</OrganizationName>					</Followup>				</Exception>			</EntityException>		</EntityDisposition>	</PayloadDisposition></ApplicationAcknowledgement>