<?xml version="1.0" encoding="UTF-8"?><ApplicationAcknowledgement xmlns="http://ns.hr-xml.org/2007-04-15" xmlns:xsi="http://www.w3.org/2001/XMLSchema-instance" xsi:schemaLocation="http://ns.hr-xml.org/2007-04-15 ApplicationAcknowledgement.xsd">	<PayloadResponseSummary>		<TransportMessageId>			<MessageIdType>MQSeriesTransactionID</MessageIdType>			<MessageId>				<IdValue>444415555</IdValue>			</MessageId>		</TransportMessageId>		<UniquePayloadTrackingId>			<IdValue>0083333333330080000D59772004-05-17-22.15.10.000000565887777</IdValue>		</UniquePayloadTrackingId>		<TransactionReceiptTimestamp>2004-05-17T22:20:00Z</TransactionReceiptTimestamp>		<ProcessingTimestamp>2004-05-17T22:40:30Z</ProcessingTimestamp>		<AcknowledgementCreationTimestamp>2004-05-17T22:41:05Z</AcknowledgementCreationTimestamp>		<ReceivedPayloadSummary>			<ReceivedPayloadSchemaURI> http://ns.hr-xml_2-3/Enrollment.xsd </ReceivedPayloadSchemaURI>			<EntityInfo>				<EntityInstanceAxisXPath>/Enrollment/Organization/Subscriber</EntityInstanceAxisXPath>				<Count>1</Count>				<EntityShortName>Subscribers</EntityShortName>			</EntityInfo>		</ReceivedPayloadSummary>	</PayloadResponseSummary>	<PayloadDisposition>		<EntityDisposition>			<EntityIdentifier>				<IdValue name="SocialSecurityNumber">555632144</IdValue>			</EntityIdentifier>			<EntitySchemaXPath>/Enrollment/Organization/Subscriber</EntitySchemaXPath>			<EntityInstanceXPath>/Enrollment/Organization/Subscriber[position()=1]</EntityInstanceXPath>			<EntityException>				<Exception>					<ExceptionIdentifier>120</ExceptionIdentifier>					<ExceptionSeverity>Fatal</ExceptionSeverity>					<ExceptionMessage>Invalid Group Number</ExceptionMessage>					<ExceptionScopeSchemaXPath>/Enrollment/Organization/Subscriber</ExceptionScopeSchemaXPath>					<SubordinateEntityXPath>/Enrollment/Organization/Subscriber/Coverage/TierCoverage/GroupNumber</SubordinateEntityXPath>					<Followup responsibleForFollowup="Payload Source Organization">						<OrganizationId>							<IdValue name="Mutually Defined">444415555</IdValue>						</OrganizationId>						<OrganizationName>BeneFriends</OrganizationName>					</Followup>				</Exception>			</EntityException>		</EntityDisposition>	</PayloadDisposition></ApplicationAcknowledgement>